{
  "entity_type": "action",
  "schema_version": "1.0",
  "action_id": "ACT-TEST-LIFECYCLE-001",
  "action_version": "1.0",
  "opportunity_id": "OPP-B05-QUAL-001",
  "founder_decision_id": "DEC-B05-APP-001",
  "action_type": "PROCESS_IMPROVEMENT",
  "title": "Process Lifecycle Action",
  "description": "Human operator lifecycle walkthrough.",
  "objective": "Test complete human operator audit trail.",
  "status": "READY_FOR_IMPLEMENTATION",
  "responsible_actor": "HUMAN_OPERATOR",
  "dependency_refs": [],
  "experiment_refs": [],
  "intervention_refs": [],
  "audit_refs": [],
  "blocked_reason": null,
  "implementation_notes": "[2026-10-03T10:04:41.197Z] Founder approval confirmed.",
  "created_at": "2026-10-03T10:04:41.018Z",
  "updated_at": "2026-10-03T10:04:41.197Z",
  "created_by": "SYSTEM",
  "is_immutable": false,
  "metadata": {}
}