{
  "entity_type": "action",
  "schema_version": "1.0",
  "action_id": "ACT-TEST-DRAFT-DEP",
  "action_version": "1.0",
  "opportunity_id": "OPP-B05-QUAL-001",
  "founder_decision_id": "DEC-B05-APP-001",
  "action_type": "TECHNICAL_SEO",
  "title": "Draft Dependency",
  "description": "This dependency remains DRAFTED.",
  "objective": "Prerequisite testing.",
  "status": "DRAFTED",
  "responsible_actor": "HUMAN_OPERATOR",
  "dependency_refs": [],
  "experiment_refs": [],
  "intervention_refs": [],
  "audit_refs": [],
  "blocked_reason": null,
  "implementation_notes": "",
  "created_at": "2026-10-03T10:04:42.241Z",
  "updated_at": null,
  "created_by": "SYSTEM",
  "is_immutable": false,
  "metadata": {}
}