{
  "entity_type": "action",
  "schema_version": "1.0",
  "action_id": "ACT-TEST-001",
  "action_version": "1.0",
  "opportunity_id": "OPP-B05-QUAL-001",
  "founder_decision_id": "DEC-B05-APP-001",
  "action_type": "SCHEMA_MARKUP",
  "title": "Deploy Canonical Schema Markup",
  "description": "Deploy canonical Organization JSON-LD markup to index.html.",
  "objective": "Establish definitive canonical organization entity identity.",
  "status": "READY_FOR_VERIFICATION",
  "responsible_actor": "HUMAN_OPERATOR",
  "dependency_refs": [],
  "experiment_refs": [],
  "intervention_refs": [],
  "audit_refs": [],
  "blocked_reason": null,
  "implementation_notes": "[2026-10-03T10:04:38.219Z] Authorized by Founder for implementation.\n[2026-10-03T10:04:38.232Z] Implementation work commenced.\n[2026-10-03T10:04:38.246Z] Markup verified locally and committed.\n[2026-10-03T10:04:38.259Z] Implementation finalized; handoff to BUILD-06 verification.",
  "created_at": "2026-10-03T10:04:38.070Z",
  "updated_at": "2026-10-03T10:04:38.259Z",
  "created_by": "SYSTEM",
  "is_immutable": true,
  "metadata": {}
}