{
  "entity_type": "action",
  "schema_version": "1.0",
  "action_id": "ACT-E2E-PREREQ-A",
  "action_version": "1.0",
  "opportunity_id": "OPP-E2E-001",
  "founder_decision_id": "DEC-E2E-APP-001",
  "action_type": "SCHEMA_MARKUP",
  "title": "Prerequisite Schema Base",
  "description": "Foundational schema deployment.",
  "objective": "Prerequisite task.",
  "status": "DRAFTED",
  "responsible_actor": "OPERATOR",
  "dependency_refs": [],
  "experiment_refs": [],
  "intervention_refs": [],
  "audit_refs": [],
  "blocked_reason": null,
  "implementation_notes": "",
  "created_at": "2026-10-03T10:08:18.171Z",
  "updated_at": null,
  "created_by": "SYSTEM",
  "is_immutable": false,
  "metadata": {}
}