{
  "entity_type": "action",
  "schema_version": "1.0",
  "action_id": "ACT-E2E-001",
  "action_version": "1.0",
  "opportunity_id": "OPP-E2E-001",
  "founder_decision_id": "DEC-E2E-APP-001",
  "action_type": "SCHEMA_MARKUP",
  "title": "Deploy Canonical Organization Schema Markup",
  "description": "Implement JSON-LD Organization markup to index.html and knowledge.html.",
  "objective": "Establish definitive entity identity.",
  "status": "READY_FOR_VERIFICATION",
  "responsible_actor": "OPERATOR",
  "dependency_refs": [],
  "experiment_refs": [],
  "intervention_refs": [],
  "audit_refs": [],
  "blocked_reason": null,
  "implementation_notes": "",
  "created_at": "2026-10-03T10:08:15.116Z",
  "updated_at": "2026-10-03T10:08:16.164Z",
  "created_by": "SYSTEM",
  "is_immutable": true,
  "metadata": {}
}