{
  "entity_type": "action",
  "schema_version": "1.0",
  "action_id": "ACT-B06-READY-001",
  "action_version": "1.0",
  "opportunity_id": "OPP-B06-001",
  "founder_decision_id": "DEC-B06-APP-001",
  "action_type": "SCHEMA_MARKUP",
  "title": "Deploy Verification Action",
  "description": "Deploy canonical schema markup for verification testing.",
  "objective": "Verify entity recognition improvement.",
  "status": "READY_FOR_VERIFICATION",
  "responsible_actor": "HUMAN_OPERATOR",
  "dependency_refs": [],
  "experiment_refs": [],
  "intervention_refs": [],
  "audit_refs": [],
  "blocked_reason": null,
  "implementation_notes": "",
  "created_at": "2026-10-03T10:04:45.819Z",
  "updated_at": "2026-10-03T10:04:45.974Z",
  "created_by": "SYSTEM",
  "is_immutable": true,
  "metadata": {}
}